is_gorafi,title,category
False,Kanye West suscite à nouveau l’indignation avec son t-shirt frappé d’une croix gammée,culture
False,God Save The Tucheenregistre un million d’entrées mais reste en deçà des épisodes 2 et 3,culture
False,"À Rio, Shakira lance sa première tournée mondiale en sept ans avec un show exceptionnel",culture
False,Une exposition à la Philharmonie de Paris plonge les visiteurs dans les premiers jours du disco,culture
False,"The Brutalist,Captain America,Prima la vita... Les films à voir ou à éviter cette semaine",culture
False,"Captain America: Brave New Worldavec Harrison Ford, les USA de Trump et Musk dans un miroir (à peine) déformé",culture
False,"MeToo dans le cinéma: «La plupart des actrices regrettent tout ça», explique l’acteur Patrick Chesnais",culture
False,Un dessin animé chinois se hisse dans le top 10 des films d’animation les plus rentables,culture
False,"Brady Corbet, réalisateur deThe Brutalist: « Trump et les autocrates du monde entier ont une façon étrange de romantiser les années 1950 »",culture
False,Un tableau mécanique sur l’éducation de Louis XV exposé au château de Versailles,culture
False,"Avec le groupe de musique Percujam, l’autisme donne la note au Casino de Paris",culture
False,« Je dors sur un banc en attendant d’être expulsé » : Ai Weiwei interdit d'entrée en Suisse,culture
False,"«Des films comme ça, on n’en voit pas beaucoup dans sa vie» :The Brutalist,le film choc sur le rêve américain et ses mirages",culture
False,"Notre critique dePrima la vita,un père nommé Comencini",culture
False,"Francesca Comencini, réalisatrice dePrima la vita: «J’ai tu cette histoire toute ma vie»",culture
False,"Notre critique deStrip-tease intégral: bimbos, autopsie et zéro déchet",culture
False,Adrien Brody: «TheBrutalistdépeint la complexité du rêve américain»,culture
False,"Velouté d’artichaut, premiers films et absents remarqués... Dans les coulisses du grand dîner des César",culture
False,Pourquoi Anthony Mackie a changé de costume pourCaptain America: Brave New World,culture
False,Les plages du Débarquement et les forteresses de Carcassonne veulent être protégées par l’Unesco,culture
False,« Je sais que c’est truqué » : Pascal Obispo dénonce l’organisation des Victoires de la musique,culture
False,"Bridget Jones : folle de lui, une veuve quinqua à l’ère MeToo",culture
False,"« Préparez-vous Paris, j’arrive ! » : après 18 ans d’absence, Diana Ross revient en France pour un concert unique",culture
False,Sylvie Vartan mise à l’honneur aux 40eVictoires de la musique,culture
False,Notre critique desSuppliques: six destins tragiques sortis de leurs tombeaux et sublimés,culture
False,"Un exemplaire de la première édition d’Harry Potter,destiné à être jeté, vendu 21 000 livres",culture
False,Des milliers d’artistes demandent l’annulation d’une vente d’œuvres créées par l’IA chez Christie’s,culture
False,"Serge Lehman, champion de la pop culture à la française",culture
False,Un «film coup de poing»:Le Mohicanmet tous les maux de la Corse à l’écran,culture
False,"Installé à Madrid, Richard Gere appelle à «résister» contre la «brute» et le «gangster» Donald Trump",culture
False,« Une partie de la magie a disparu » : Selena Gomez répond à la polémique de Karla Sofía Gascón,culture
False,"Yan Pei-Ming, un peintre contemporain au Vatican",culture
False,"Opéra: notre critique deSémélé, un vaudeville vivant mais inachevé",culture
False,"À Drouot, la vente d’armes à fort pedigree du spécialiste Philippe Missillier fait figure d’événement",culture
False,Rokia Traoré raconte la prison et comment l’écriture a été son refuge,culture
False,Un concert improvisé d’Ed Sheeran organisé en pleine rue en Inde interrompu par la police,culture
False,Des fans d’Oasis voient leurs billets de concert annulé en raison des fraudes pour le marché noir,culture
False,"Tourné, le biopic de Pharrell Williams par Michel Gondry ne verra finalement jamais le jour",culture
False,Joan Baez a adoré la performance de Monica Barbaro dansUn parfait inconnu,culture
False,David Lynch est décédé d’un arrêt cardiaque,culture
False,"Super Bowl : « Le monde est en train de guérir », jubile Donald Trump après les huées envers Taylor Swift",culture
False,"Super Bowl : entre classiques du rap et attaques contre Drake, Kendric Lamar interprète une ode au hip-hop américain",culture
False,"Faire passer un message, montrer son appartenance ou son engagement... Le wax, épatante saga au Musée de l’Homme",culture
False,"En lice pour les Oscars: Adrian Brody, du pianiste au brutaliste",culture
False,"«Il y a des enjeux liés à l’histoire du wax»: de l’art contemporain à la BD, remonter le fil de cette étoffe",culture
False,"Laurence Equilbey, chef d’orchestre: «Notre vrai patrimoine, ce ne sont pas nos clochers, c’est d’abord la musique !»",culture
False,La passion cachée du galeriste Kamel Mennour pour Eugène Carrière,culture
False,"Nicolas Ungemuth: «Mammifères II, radioscopie jouissive des misères du monde moderne»",culture
False,Vatican : un homme interpellé après avoir endommagé les candélabres dans la basilique Saint-Pierre,culture
False,"À Paris, New York, Londres ou Madrid, comment les musées s’adaptent au défi du sur-tourisme",culture
False,Comment Sabrina Carpenter tente de s’imposer sur la très concurrentielle scène de la pop américaine,culture
False,"Kendrick Lamar, nouveau roi du rap, prêt à enflammer le Super Bowl",culture
False,La restauration de la Grande Mosquée al-Nouri à Mossoul « redonne son identité » à la ville irakienne,culture
False,Tom Cruise honoré par la Grande Médaille de l’Aéro-Club de France,culture
False,"En Syrie, l'opéra de Damas espère des « lendemains meilleurs » après la chute de Bachar al-Assad",culture
False,Roberto Saviano : l’histoire vraie d’un martyr de la guerre contre la mafia,culture
False,Emilia Pérezremporte le Goya du meilleur film européen,culture
False,"Strip-tease intégral, l’émission culte de la télé belge revient au cinéma",culture
False,Régis Debray: «J’essaierai d’écrire des livres qui restent sur une époque qui passe»,culture
False,Courir 24 heures de suite devant une scie circulaire : le rappeur Rilès a commencé sa performance,culture
False,Quand la voix contrefaite de Sylvester Stallone devient le symbole de la lutte des comédiens contre l’IA,culture
False,On a testé une soirée Chez Michou transformé en comedy club par Gad Elmaleh,culture
False,"Yoa et Wilco, découvrez les albums de la semaine duFigaro",culture
False,Quand la base sous-marine de Saint-Nazaire... prend l’eau,culture
False,Un camion-opéra promeut l’art lyrique dans les campagnes françaises,culture
False,"L’œil de l’INA : 40 ans de « Télématin », un bébé qui a bien grandi",culture
False,"Découverte de la résidence du roi d’Angleterre tué à Hastings, figure de la tapisserie de Bayeux",culture
False,Berlinale 2025 : pluie de stars sur fond de tensions politiques,culture
False,"«J’ai toujours composé et chanté pour l’amour de l’art»: Cyndi Lauper, les adieux d’une star des années 80",culture
False,Exposition: Bob Marley dans l’œil du photographe Dennis Morris,culture
False,"Mort de la romancière Antonine Maillet, première lauréate non-européenne du Goncourt, à l’âge de 95 ans",culture
False,«Verso» : ce que cache le dos des tableaux de maître,culture
False,"Brady Corbet, réalisateur deThe Brutalist: « Trump et les autocrates du monde entier ont une façon étrange de romantiser les années 1950 »",culture
False,"The Brutalist,Captain America,Prima la vita... Les films à voir ou à éviter cette semaine",culture
False,"Fannie la Renoueuse,dans les rouages d’esprits tourmentés",culture
False,"Découverte de la résidence du roi d’Angleterre tué à Hastings, figure de la tapisserie de Bayeux",culture
False,"La Diagonale du Figaro N°59 : «Pragg», l’intrépide vainqueur de Wijk aan Zee, le Wimbledon des échecs",culture
False,"Cédric Gras, l’appel de la Russie : «Je la voyais comme un énième voyage, c’est le seul pays où j’ai eu envie de m’arrêter»",culture
False,"Kamome Shirahama, dessinatrice enchanteresse deL’Atelier des sorciers",culture
False,"À New York, un violon Stradivarius vendu 11,3 millions de dollars aux enchères",culture
False,«Machina Sapiens» ou les artistes à l’heure de l’IA à la Conciergerie,culture
False,"«Nous ne sommes pas contre l’IA mais pour l’humain»: sur les plateformes de streaming, les abonnés dans le flou",culture
False,George Clooney fait ses débuts à Broadway dans une pièce sur la désinformation en pleine Amérique trumpienne,culture
False,Pass Culture : à qui profitent vraiment les 708 millions d’euros dépensés en cinq ans ?,culture
False,Le monde de la culture gronde avant le sommet sur l’IA « des décideurs et des entreprises »,culture
False,"À partir de 2031,La Jocondedisposera d’une salle dédiée de 2 000 m2au Louvre",culture
False,«C’est un travail de transmission»: le Musée d’art et d’histoire du judaïsme prépare sa mue,culture
False,"Frédéric Beigbeder: «J’écris l’Iliadede Pierre Michon, le baroud d’honneur de notre plus grand écrivain»",culture
False,Musique: des artistes pionniers militent pour une IA personnalisée,culture
False,Intelligence artificielle: la Sacem en route vers une réglementation,culture
False,"IA et musique, un accord encore loin d’être parfait",culture
False,"Naâman, chanteur reggae, emporté par une tumeur au cerveau à 34 ans",culture
False,Pascal Dusapin: «Il faut remettre l’œuvre musicale au cœur de nos sociétés»,culture
False,"Location meublée, faut-il passer par une conciergerie ?",culture
False,"« L’IA va permettre de repousser les limites de la créativité humaine », selon Brad Smith, vice-chairman de Microsoft",culture
False,"Cimabue, le maillon marquant de la peinture occidentale",culture
False,"Déjà reporté, le jeu vidéo Football Manager 2025 finalement annulé",culture
False,Mark Zuckerberg est devenu un « obsédé du pouvoir » selon l’acteur qui l’a incarné dansThe Social Network,culture
False,Les Tuche 5: les aventures britanniques de la famille de Bouzolles écrasent la concurrence,culture
False,Dorothée et Philippe Katerine prêtent leur voix pour le prochain film des Schtroumpfs,culture
False,"Dans leur course mouvementée aux Oscars, Jacques Audiard coupe les ponts avec Karla Sofía Gascón",culture
False,"Paris, Marseille, Montpellier... Le nouvel «Hollywood français» a vu trop grand",culture
False,"AprèsTraviataetManon,la soprano Pretty Yende tente une première incursion dans l’opéra baroque",culture
False,L’Académie des beaux-arts monte au créneau pour défendre la culture face aux coupes budgétaires,culture
False,"Théâtre : entre l’ogre Jacques Weber et le débonnaire Pierre Arditi,Le Figaroa choisi",culture
False,"60 ans après Luchino Visconti, François Ozon s’attaque à une nouvelle adaptation deL’Étrangerd’Albert Camus",culture
False,Karla Sofia Gascón: un éditeur espagnol renonce à rééditer son roman autobiographique,culture
False,"Notre critique deLa Vie rêvée, la grâce de Kelly Rivière",culture
False,"Christian Jambet, premier islamologue, reçu à l’Académie française",culture
False,"Paul-Loup Sulitzer, le romancier des années fric",culture
False,"Exposition: à la BnF, la bonne fortune de l’Apocalypse",culture
False,"À qui sait attendre, de Michael Connelly: l’affaire du Dahlia noir",culture
False,Elton John sortira un nouvel album en duo avec Brandi Carlile intituléWho Believes in Angels?,culture
False,Daniel Barenboim annonce souffrir de la maladie de Parkinson,culture
False,Deux femmes et un homme portent à leur tour plainte contre P. Diddy pour agressions sexuelles,culture
False,"Le Roman de Mécène,de Pascale Roze: à la rencontre d’un citoyen romain extravagant passé à la postérité",culture
False,"Au-delà du mur,de Katja Hoyer: il était une fois la RDA",culture
False,L’homme d’affaires Paul-Loup Sulitzer est mort à 78 ans,culture
False,« La mort de papa nous a divisés encore plus » : la succession Delon n’avance pas selon Alain-Fabien,culture
False,Box-office France : belle entrée en scène pourUn parfait inconnu,culture
False,"Le duc de Bourgogne, de Jean de La Rochefoucauld: l’homme qui ne fut jamais roi",culture
False,Ozzy Osbourne et Black Sabbath sur scène pour un ultime concert à Birmingham,culture
False,L’âge fragilede Donatella Di Pietrantonio : meurtre au camping,culture
False,"Nouvelles de jeunesse, de Tennessee Williams: quelque chose de Tennessee",culture
False,"Dany Boon renoue avec la scène, après « sept ans de disette »",culture
False,"Juno et Legs, de Karl Geary: une belle ballade irlandaise",culture
False,"Un effondrement parfait, de Jérôme Leroy : autoportrait de l’artiste en joyeux mélancolique",culture
False,"6 avenue George V, de Thomas B. Reverdy: une valse à quatre temps",culture
False,God Save The Tuche: un cinquième volet de trop ou le meilleur de la franchise ?,culture
False,"L’univers ultraviolent du rappeur P. Diddy, «manipulateur de génie», raconté dans une série documentaire",culture
False,"DansJurassic World - Renaissance,Scarlett Johansson prend la relève de Chris Pratt",culture
False,"Acheté dans une brocante au Mans en 2010, le tableau s’avère être un Modigliani",culture
False,"Vers la joie, de Laurence Tardieu: du chaos à la rédemption",culture
False,La Cité du cinéma se cherche un avenir dans l’événementiel et les expositions blockbusters,culture
False,"Daniel Liszt, un fils mal-aimé, de Charles Dupêchez: duel d’ego",culture
False,"À Cannes, La Malmaison entend devenir une adresse incontournable de l’art moderne et contemporain",culture
False,"Tout le monde aime Clara, de David Foenkinos: ils se sont tant aimés",culture
False,«Une libération et un accablement» : les difficiles adieux de Thierry Malandain au Ballet de Biarritz,culture
False,"Ta promesse, de Camille Laurens: anatomie d’une relation dévorée par un pervers narcissique",culture
False,"Sandrine Sarroche, le rire qui fait du bien",culture
False,"La loi de la tartine beurrée, de J. M. Erre: elle et lui tendance Ionesco",culture
False,"Gaëtan Bruel, le directeur de cabinet de Rachida Dati, est nommé à la tête du Centre national du cinéma",culture
False,"Charmian et Jack London, de Christel Mouchard: l’amour à l’aventure",culture
False,Pierre Michon: «Être amoureux c’est se créer une religion dont le dieu est faillible»,culture
False,La fille de Gisèle Pelicot va publier un deuxième livre sur les viols de Mazan,culture
False,"Daoud, Faye, Da Costa, Dicker, Bonnefoy… Une dizaine d’auteurs refusent de « faire la fête » avec Bardella à l’invitation deL’Express",culture
False,Berlinale 2025 : pluie de stars sur fond de tensions politiques,culture
False,"«J’ai toujours composé et chanté pour l’amour de l’art»: Cyndi Lauper, les adieux d’une star des années 80",culture
False,Exposition: Bob Marley dans l’œil du photographe Dennis Morris,culture
False,"Mort de la romancière Antonine Maillet, première lauréate non-européenne du Goncourt, à l’âge de 95 ans",culture
False,«Verso» : ce que cache le dos des tableaux de maître,culture
False,"Brady Corbet, réalisateur deThe Brutalist: « Trump et les autocrates du monde entier ont une façon étrange de romantiser les années 1950 »",culture
False,"The Brutalist,Captain America,Prima la vita... Les films à voir ou à éviter cette semaine",culture
False,"Fannie la Renoueuse,dans les rouages d’esprits tourmentés",culture
False,"Découverte de la résidence du roi d’Angleterre tué à Hastings, figure de la tapisserie de Bayeux",culture
False,"La Diagonale du Figaro N°59 : «Pragg», l’intrépide vainqueur de Wijk aan Zee, le Wimbledon des échecs",culture
False,« C’est déjà très bien » : Artus réagit à l’unique nomination de son filmUn p’tit truc en plusaux César 2025,culture
False,"AprèsGod Save the Tuche, Jean-Paul Rouve imagine déjà donner une suite à la saga",culture
False,"Un blaireau, fan de Banksy, remporte le prix du public du Wildlife Photographer of the Year 2024",culture
False,Netflix prend ses distances avec Karla Sofia Gascón d'Emilia Pérezaprès ses tweets polémiques,culture
False,"GodSavetheTuche,Mongâteaupréféré,5 septembre...Les films à voir et à ne pas voir cette semaine",culture
False,Clara Luciani entre au musée Grévin,culture
False,Rachida Dati entend « rapprocher la politique de l’architecture des réalités locales »,culture
False,"La directrice des Beaux-Arts de Paris, Alexia Fabre, non reconduite sur fond de projet polémique",culture
False,La bande-annonce desQuatre Fantastiquesannonce la fin de la Terre dévorée par une entité cosmique,culture
False,"Franck Desplanques, le photographe qui s’efforce de rendre visible l’invisible",culture
False,40.000 personnes du secteur de la Culture vent debout contre les coupes budgétaires,culture
False,Notre critique de5Septembre: la mort sur un plateau,culture
False,"Notre critique dePaddington au Pérou, les aventuriers de l’ourson perdu",culture
False,Notre critique deMon gâteau préféré: la crème du cinéma iranien,culture
False,"Notre critique deLa Mer au loin: le raï, la petite musique de l’exil",culture
False,5 Septembre: la terreur en Mondovision aux JO de Munich,culture
False,Notre critique dePresence: un remake dépressif duBeetlejuicede Burton,culture
False,"Notre critique deMaria: Angelina Jolie, une Callas honorable",culture
False,"«C’était un endroit social très important quand j’étais gosse»: pour Antoine Chevrollier,La Pampaest en Anjou",culture
False,Notre critique deLa Disparition de Josef Mengele: Mikaël Chirinian à la poursuite du monstre,culture
False,« Nous ne pouvons pas laisser passer ça » : Nicolas Cage alerte sur les dangers de l’IA dans le cinéma,culture
False,"Cinémathèque française : « entre-soi », « défaut de pilotage » et confusion des intérêts dénoncés par le Cour des comptes",culture
False,Des dessins de nus signés Yves Saint Laurent trouvent preneurs aux enchères,culture
False,La Comédie française « très inquiète » face au gel du pass culture collectif,culture
False,"Beyoncé : après son sacre aux Grammys Awards, les écoutes de son dernier album explosent sur Spotify",culture
False,"« Emportée par ses paroles, je me suis sentie lourde » : immersion dans un concert sous hypnose",culture
False,"Juliette Binoche, présidente du jury du 78eFestival de Cannes",culture
False,"Florence Foresti sacrée humoriste de l'année, Dany Boon honoré aux Auguste de l'humour",culture
False,Pass Culture : une suppression de la part individuelle avant 17 ans «en cours d'examen»,culture
False,AC/DC annonce un concert au Stade de France le 9 août 2025,culture
False,La renaissance des studios de Bry-sur-Marne,culture
False,Notre critique deGod Save the Tuche: on Tuche le fond !,culture
False,"Après ses tweets critiquant l’islam, Karla Sofía Gascón d’Emilia Perezpeut-elle perdre sa nomination aux Oscars ?",culture
False,13 millions d’euros de l’État pour rénover la tapisserie de Bayeux et lui offrir un nouveau musée en 2027,culture
False,Une partie du rempart sud-est du château d’Amboise menace de s’effondrer,culture
False,Producteurs et gérants de salles voient dans la tarification dynamique des concerts une planche de salut,culture
False,"« Je n’ai pas peur d’en parler » : Rosa Bursztein, victime d’antisémitisme, refuse de se faire « intimider »",culture
False,"Yvan Monka, «l’édutubeur» des maths",culture
False,"Laura Cahen, Victor Solf, Solann: les bons crus de la musique actuelle",culture
False,"Olga Neuwirth: «Quand j’ai commencé, je voulais donner des coups de marteau dans la musique contemporaine»",culture
False,Le rappeur Hatik interrompt son concert à Clermont-Ferrand pour aller aux urgences,culture
False,L’acteur Stuart Martin ferait figure de favori pour incarner James Bond même si la guerre couve en coulisses,culture
False,Festival de Gérardmer : le Canadien Chris Nash récompensé pourIn a violent nature,culture
False,Palmarès: qui sont les grands gagnants des Grammy Awards 2025 ?,culture
False,"Grammy Awards : le titre des Beatles, retravaillé avec l’IA, remporte le prix de la meilleure prestation rock",culture
False,Cowboy Carter Tour : les fans de Beyoncé au défi de décrocher une place pour ses concerts au Stade de France,culture
False,Grammy Awards : Beyoncé surclasse Taylor Swift et Billie Eilish en remportant le prix de l'album de l'année,culture
False,Grammy Awards : Taylor Swift remet le prix du meilleur album country à Beyoncé,culture
False,Grammy Awards : Chappell Roan élue révélation de l'année,culture
False,Grammy Awards : le groupe de métal français Gojira sacré pour sa prestation aux JO,culture
False,«Réfléchir à l’éternel présent»: quand Jacques Gamblin fixe en mots la mémoire qui flanche,culture
False,Ces astuces pour enregistrer un appel avec son mobile,culture
False,"Les Monologues du vagin, Lily et LilyouLa Valse des pingouins…Les pièces de théâtre mythiques à l’honneur en cette rentrée",culture
False,"Oum Kalsoum, «la diva vit toujours» cinquante ans après",culture
False,"Vitrine du cinéma indépendant américain et bastion de la diversité, Sundance n’a pas dit son dernier mot",culture
False,"Mon gâteau préféré, une comédie dramatique iranienne qui bouleversera le cœur des plus secs",culture
False,"Pour voir la Joconde au Louvre, il faudra désormais un billet en plus de l'accès au musée",culture
False,"Aya Nakamura, objet d’un dictionnaire critique aux accents hagiographiques",culture
False,Festival de la BD d’Angoulême: le ministère de la Culture s'inquiète de «dysfonctionnements» managériaux,culture
False,"« Il y a une pression de la rue » pour restituer les œuvres pillées en Afrique, selon l'Unesco",culture
False,L’écriture peut-elle guérir les blessures ?,culture
False,Festival BD d’Angoulême 2025 : Luz remporte le Fauve d’or avecDeux filles nues,culture
False,"Patrick Besson, le hussard mélancolique: «J’ai fait partie d’une bande de jeunes devenus vieux»",culture
False,"«Je reviendrai peut-être en politique»: les aveux d’Éric Dupond-Moretti, de retour sur les planches",culture
False,Éric Neuhoff: «Les artisans du Nouvel Hollywood ont tout saccagé»,culture
False,"À 98 ans, Judith Magre toujours sur scène déclame son amour pour Baudelaire",culture
False,"Le Goncourt 1960, signé d'un sympathisant de Hitler, va être réédité",culture
False,"Faute de subventions, le musée de la Croix-Rouge pourrait fermer ses portes",culture
False,L’œil de l’INA : quand la comédienne Catherine Laborde faisait la pluie et le beau temps,culture
False,Berlinale 2025 : pluie de stars sur fond de tensions politiques,culture
False,"«J’ai toujours composé et chanté pour l’amour de l’art»: Cyndi Lauper, les adieux d’une star des années 80",culture
False,Exposition: Bob Marley dans l’œil du photographe Dennis Morris,culture
False,"Mort de la romancière Antonine Maillet, première lauréate non-européenne du Goncourt, à l’âge de 95 ans",culture
False,«Verso» : ce que cache le dos des tableaux de maître,culture
False,"Brady Corbet, réalisateur deThe Brutalist: « Trump et les autocrates du monde entier ont une façon étrange de romantiser les années 1950 »",culture
False,"The Brutalist,Captain America,Prima la vita... Les films à voir ou à éviter cette semaine",culture
False,"Fannie la Renoueuse,dans les rouages d’esprits tourmentés",culture
False,"Découverte de la résidence du roi d’Angleterre tué à Hastings, figure de la tapisserie de Bayeux",culture
False,"La Diagonale du Figaro N°59 : «Pragg», l’intrépide vainqueur de Wijk aan Zee, le Wimbledon des échecs",culture
False,Les députés LR voteront contre la nomination de Richard Ferrand au Conseil constitutionnel,politique
False,"Refus de célébrer un mariage : «Avec la politisation de certains juges, je ne sais pas comment ça va finir», s’inquiète Robert Ménard",politique
False,«On gaspille l’argent des Français»: la colère de Sarah Knafo contre l’Agence française de développement,politique
False,Laïcité dans le sport : vers une interdiction du port de signes religieux ?,politique
False,"Dominique Chagnollaud : «Avec Richard Ferrand, le Conseil constitutionnel se retrouverait dans une situation très problématique»",politique
False,"Refus de célébrer un mariage : après s’être opposé au «plaider coupable», Robert Ménard sera jugé en correctionnelle",politique
False,"Expulsion de clandestins algériens : «L’Algérie ne respecte pas le droit», estime Bruno Retailleau",politique
False,"Présidence LR : «Je ne me présente pas contre Bruno Retailleau mais pour refonder la droite», affirme Laurent Wauquiez",politique
False,Guillaume Tabard: «Quand la droite hier raillée redevient à la mode»,politique
False,Stéphane Demilly: «Je veux donner aux maires le pouvoir de refuser une union civile quand la personne est en situation irrégulière»,politique
False,Le budget 2025 de la Sécurité sociale définitivement adopté après un dernier vote au Sénat,politique
