is_gorafi,title,category
True,5 choses que vous ne voulez absolument pas savoir sur Marion Maréchal,politique
True,5 choses que vous regretterez aussitôt de savoir sur Florian Philippot,politique
True,Joe Biden en France : le président américain s’est dit impatient de s’entretenir avec Raymond Poincaré,politique
True,5 choses que vous ne voulez absolument pas savoir sur Manon Aubry,politique
True,5 choses que vous ne voulez absolument pas savoir sur François-Xavier Bellamy,politique
True,5 choses que vous ne voulez absolument pas savoir sur Raphaël Glucksmann,politique
True,5 choses que vous n’avez absolument pas envie de savoir sur Jordan Bardella,politique
True,Emmanuel Macron d’accord pour débattre à la télé “avec lui-même”,politique
True,5 choses que vous n’avez absolument pas envie de savoir sur Valérie Hayer,politique
True,5 astuces pour ne pas tomber amoureuse de Gérald Darmanin,politique
True,Anne Hidalgo prévient que les Parisiens qui critiquent les JO auront trois chantiers supplémentaires dans leur rue,politique
True,"Après la Nouvelle-Calédonie, Emmanuel Macron ira à la rencontre des indépendantistes du 16e arrondissement",politique
True,"Accusé de partialité après le duel Bardella/Attal, France 2 promet un duel Attal/Bardella",politique
True,"Pris en photo avec Valérie Hayer, Emmanuel Macron affirme « avoir été piégé »",politique
True,Gérald Darmanin annonce le lancement d’un plan « places nettes XXL Turbo Alpha Triple Impact »,politique
True,Fact-check : Un dénommé Jean-Marc Ayrault a-t-il un jour été ministre de la République ?,politique
True,Gabriel Attal lance “France Feignasse” pour les chômeurs de plus d’un an,politique
True,« Ça fait super mal en fait » : les députés testent un simulateur d’impôt,politique
True,"Gabriel Attal se réveille en sursaut, persuadé qu’un chômeur se cache sous son lit",politique
True,86% des Français « prêts à aider Macron » à réaliser son vœu de se baigner dans la Seine,politique
True,Le Sénat valide la mise en place d’un congé menstruel pour les hommes cis,politique
True,Gérard Larcher veut inscrire le pâté de foie et les rillettes de veau dans la Constitution,politique
True,Test : quel scandale d’Amélie Oudéa-Castéra êtes-vous ?,politique
True,« Alors c’est pour quand le bébé ? » par Emmanuel Macron,politique
True,Gabriel Attal s’entraîne à rouler les R pour parler aux agriculteurs,politique
True,"Choquée par l’absentéisme des députés, Amélie Oudéa-Castéra ne mettra plus les pieds à l’Assemblée nationale",politique
True,"En réponse au lisier versé, le gouvernement déverse Amélie Oudéa-Castéra sur les agriculteurs",politique
True,Test : êtes-vous plus jeune que Gabriel Attal ou avez-vous raté votre vie ?,politique
True,Test – Êtes-vous prête pour le réarmement démographique ?,politique
True,Ce qu’il fallait retenir de la conférence de presse d’Emmanuel Macron,politique
True,Gabriel Attal utilise un 49.3 juste pour voir ce que ça fait,politique
True,Gabriel Attal surprend tout le monde en arrivant à Matignon en abaya,politique
True,5 choses à savoir sur le nouveau Premier ministre Gabriel Attal,politique
True,Brigitte Macron assurera la Régence le temps que Gabriel Attal soit en âge de gouverner,politique
True,Elisabeth Borne démissionne pour se consacrer à la culture de ses 49.3,politique
True,"Noël – Emmanuel Macron visité durant la nuit par les fantômes des trois lois d’immigrations, passée, présente et future",politique
True,Gérald Darmanin annonce la dissolution de Gérald Darmanin,politique
True,Gabriel Attal : « Les élèves qui louperont leur brevet rejoindront désormais le Pôle Emploi Junior »,politique
True,Jean-Luc Mélenchon répondra à Gérard Larcher ce soir lors d’un freestyle dans Planète Rap,politique
True,"Relaxé, Eric Dupond-Moretti lance une enquête sur les magistrats qui l’ont accusé d’avoir enquêté sur des magistrats",politique
True,TEST – Quel membre des Républicains vous regarde dormir ?,politique
True,Les 10 dates clés de l’amitié entre les Juifs et le RN,politique
True,Crise du logement : le gouvernement pourra réquisitionner à tout moment votre clic clac,politique
True,Mathilde Panot fait son mea culpa et reconnaît que le Hamas « n’est pas toujours très sympa »,politique
True,"Par mesure de sûreté, Gabriel Attal prévoit la suppression de 6500 postes d’enseignants en 2024",politique
True,Elisabeth Borne aurait besoin de deux fois plus de 49.3 pour continuer à ressentir les effets,politique
True,Alcool et santé – Le ministère de la Santé renommé ministère de la Gueule de bois,politique
True,Pour mieux les combattre Gérald Darmanin demande aux élus RN d’arrêter d’être toujours d’accord avec lui,politique
True,Emmanuel Macron veut une rentrée « dès le 1er juillet » pour les enfants de chômeurs,politique
True,"Pour se rafraîchir, le gouvernement conseille de regarder des films de Noël",politique
True,"Pour revenir plus rapidement au travail, Aurore Bergé propose de raccourcir de 2 mois le temps de grossesse",politique
True,Fonds Marianne – Marlène Schiappa affirme avoir « tout fait pour honorer la mémoire de Samuel Machin »,politique
True,Éducation – Gabriel Attal annonce deux heures d’éléments de langage obligatoires dès le CP,politique
True,Remaniement : Aurore Bergé nommée ministre en charge de la Récupération politique,politique
True,Mort de Berlusconi : Macron salue la mémoire « d’une figure majeure de la gauche »,politique
True,Agression – Gérald Darmanin rappelle les gestes à avoir lorsqu’on est victime de Gérald Darmanin,politique
True,Ce qu’il fallait retenir de l’allocution d’Emmanuel Macron,politique
True,Marlène Schiappa met sa couverture Playboy aux enchères pour rembourser le Fonds Marianne,politique
True,187 citoyens tirés au hasard seront consultés sur la question de la fin de vie d’Elisabeth Borne,politique
True,"Après Marlène Schiappa dans Playboy, Gérald Darmanin annule son tournage avec Papacito",politique
True,5 conseils d’Olivier Dussopt pour avoir moins de charisme,politique
True,Emmanuel Macron propose finalement la retraite à 63 ans et 12 mois,politique
True,Fact checking : Emmanuel Macron a-t-il retiré son caleçon en direct ?,politique
True,Ce qu’il fallait retenir de l’entretien d’Emmanuel Macron,politique
True,"Pour redorer son image, le SNU change de nom et devient la « Jeunesse Macronienne »",politique
True,"Laissé sans surveillance par Élisabeth Borne, un 49.3 circule en liberté dans Paris",politique
True,5 précédents cas dans lequel le gouvernement a dû avoir recours au 49.3 pour faire passer une loi,politique
True,Emmanuel Macron offre un portrait de René Coty au président congolais,politique
True,TEST : Quelle fausse promesse d’Emmanuel Macron êtes-vous ?,politique
True,Olivier Dussopt élu personnalité de l’année par Elisabeth Borne,politique
True,Bruno Le Maire demande aux pauvres d’être « un peu plus créatifs »,politique
True,Olivier Véran : « La retraite à 1200 euros sera garantie pour ceux qui ont commencé à travailler dès l’âge de 9 ans »,politique
True,Sébastien Lecornu demande à Emmanuel Macron de suspendre toute relation diplomatique avec le Wakanda,politique
True,Réforme des retraites – La NUPES accusée d’obstruction parlementaire après avoir déposé 2000 amendements en Klingon,politique
True,Congrès du PS – La victoire d’Olivier Faure toujours contestée par l’autre type,politique
True,Les chômeurs devront être équipés dès la rentrée d’un collier électrique,politique
True,Les pharmaciens autorisés à délivrer des antidépresseurs sur simple présentation d’une simulation retraite,politique
True,Brigitte Macron favorable au port de l’uniforme floqué LREM,politique
True,"Cette année, vos bonnes résolutions seront prises directement par Gabriel Attal",politique
True,"Selon Emmanuel Macron, personne n’aurait pu prévoir que le soleil se lève le matin",politique
True,Une petite fille qui prétendait fermer le robinet quand elle se brosse les dents arrive au second tour du congrès EE-LV,politique
True,Fact-check : Elisabeth Borne a-t-elle vraiment écrasé un pauvre avec un monstertruck ?,politique
True,Coupe du monde – Emmanuel Macron appelle à ne pas politiser l’esclavage,politique
True,"Pour prouver qu’il peut aussi être radical, Yannick Jadot boit deux panachés",politique
True,75% des Français favorables à une pénurie de déclarations de Gabriel Attal,politique
True,Les députés autorisés à venir avec des jeux de société les jours de 49.3,politique
True,"Affaibli par des affaires judiciaires, Jean-Christophe Lagarde quitte l’UDI pour entrer au gouvernement",politique
True,"Pour gagner plus, Pap Ndiaye conseille aux enseignants de changer de métier",politique
True,Bruno Le Maire montre encore l’exemple en arrivant au Conseil des ministres en chiens de traîneau,politique
True,Réforme des Retraites – Emmanuel Macron favorable à l’avancement de plusieurs années de l’âge de la mort,politique
True,Élisabeth Borne encourage les Français à passer l’hiver dans leur résidence aux Seychelles,politique
True,Les Français devront placer une photo de Bruno Le Maire en col roulé au-dessus de leur radiateur,politique
True,"Pour combattre les stéréotypes de genre, Pap Ndiaye promet que les enseignants hommes seront aussi mal payés que les femmes",politique
True,Gabriel Attal : « Les Français doivent mesurer leur chance que notre roi Emmanuel soit encore en vie »,politique
True,Pouvoir d’achat – L’Assemblée autorise l’essence coupée à l’urine de cycliste professionnel,politique
True,Les ministres devront utiliser des moyens de transport durables pour se rendre à l’aéroport,politique
True,Pour toucher le RSA il faudra désormais gagner un SMIC,politique
True,"Pour maintenir sa cote de popularité, Élisabeth Borne prolonge ses vacances de deux semaines",politique
True,Incendies – Le gouvernement promet de doubler le nombre de calendriers des pompiers à Noël,politique
True,Sécheresse – Christophe Béchu invite les Français à vider des bouteilles d’eau minérale dans les rivières,politique
True,Nouvelle polémique après une sortie en mer d’Emmanuel Macron en béluga,politique
True,Pénurie d’eau – Le gouvernement recommande aux usagers de boire leur urine,politique
True,"Pour 3 millions d’euros, McKinsey conseille au gouvernement de mettre de l’eau sur les incendies",politique
True,Emmanuel Macron défend ben Salmane « On m’a certifié que l’exécution de Khashoggi s’est déroulée dans le respect du bien-être animal »,politique
True,"Pour se chauffer l’hiver prochain, Bruno Le Maire conseille aux Français de souffler fort dans leurs mains",politique
True,Aymeric Caron invite à ne pas parler de « moustique » mais de « surmoucheron »,politique
True,Ecologie – Scandale après qu’Emmanuel Macron a jeté un ministre dans la poubelle jaune,politique
True,"Après vérification des infos, Le Point retire son article « Mélenchon, ses 2000 esclaves sexuels, sa collection de cornes de rhinocéros et son building à Dubaï »",politique
True,L’homme qui prétendait avoir vu Élisabeth Borne rire en 1986 avoue sur son lit de mort qu’il avait tout inventé,politique
True,Emmanuel Macron va rencontrer le réchauffement climatique pour lui demander de cesser immédiatement son agression,politique
True,L’Express retire son numéro spécial contenant un lot de fléchettes et une cible à l’effigie de Jean-Luc Mélenchon,politique
True,Cinq astuces pour rendre les élections législatives passionnantes,politique
True,"5 choses à savoir sur Olivier Dussopt, ministre du Travail",politique
True,Manuel Valls refoulé après avoir tenté de pénétrer à l’Élysée avec un faux titre de ministre,politique
True,"5 choses à savoir sur Amélie de Montchalin, ministre de la Transition écologique",politique
True,Yannick Jadot se retire de la politique pour souffler sur des éoliennes à plein temps,politique
True,"Écologie – Cinq choses à savoir sur Nougat, l’ours polaire adopté à l’Élysée par Emmanuel Macron",politique
True,Accusé de viol Damien Abad appelle au respect de son statut de présumé ministre,politique
True,Yannick Jadot et Anne Hidalgo se cotisent pour acheter un détecteur de métaux et trouver de l’argent,politique
True,"Pour son investiture, Elisabeth Borne sacrifie un chômeur dans la cour de Matignon",politique
True,"5 choses à savoir sur Elisabeth Borne, nouvelle Première ministre",politique
True,Yannick Jadot annonce se mettre en retrait de l’écologie pour se lancer en politique,politique
True,Emmanuel Macron promet la parité du gouvernement entre macronistes de droite et macronistes de centre-droit,politique
True,Laurent Wauquiez : « Les femmes en burkini devront nager uniquement dans le pédiluve »,politique
True,Union de la gauche – Jean-Luc Mélenchon propose aux députés PS de faire le ménage dans les locaux de son parti,politique
True,"Soucieux de l’avis du peuple, Emmanuel Macron lance un référendum sur le lieu de construction de sa statue géante",politique
True,Le voile dégringole à la 279ème place comme préoccupation principale des Français,politique
True,"Pour apaiser les tensions en Corse, le ministre de l’Intérieur change son nom en Geraldo Darmanini",politique
True,"Anne Hidalgo : « Il faut dire à Poutine : dis donc mon p’tit bonhomme, ça va bien deux minutes ! »",politique
True,"En cas de victoire, Éric Zemmour nommera Marion Maréchal ministre de la vaisselle",politique
True,Ukraine – Ce qu’il fallait retenir de l’allocution d’Emmanuel Macron,politique
True,Gérald Darmanin demande aux réfugiés de Calais de donner leur tente aux réfugiés ukrainiens,politique
True,"Si Poutine continue ses attaques, BHL menace d’enlever le dernier bouton de sa chemise",politique
True,Élections – Les bulletins des non-vaccinés ne compteront que pour un demi vote,politique
True,Sondage : 78% des Français aimeraient hiberner jusqu’à la fin du 2nd tour,politique
True,"Qui est Wushu, le panda milliardaire qui finance la campagne de Yannick Jadot ?",politique
True,Elections: Jean Lassalle a bel et bien obtenu ses 500 bouteilles de pinard,politique
True,78% des Français d’accord pour remplacer la Primaire populaire de la gauche par un combat au katana,politique
True,Alpes-Maritimes : Eric Ciotti met en place des tests PCR d’islamo-gauchisme gratuits,politique
True,Manuel Valls en garde à vue pour ne pas avoir dit du bien d’Emmanuel Macron depuis trois jours,politique
True,François Bayrou tente un comeback en disant avoir très envie d’enquiquiner les non-vaccinés,politique
True,Présidentielle – Anne Hidalgo accuse Christiane Taubira de vouloir lui voler sa défaite,politique
True,Eric Zemmour souhaite le retour de l’uniforme chez GiFi,politique
True,Jean-Michel Blanquer présente ses excuses « à tout le corps enseignant » depuis sa piscine privée aux Maldives,politique
True,Test : êtes-vous un jeune avec Zemmour ou avez-vous déjà fait l’amour ?,politique
True,Élection 2022 : Emmanuel Macron annonce avoir enfin terminé son programme pour sa campagne de 2017,politique
True,Jean-Luc Mélenchon ouvert à une primaire avec lui-même,politique
True,Élection présidentielle : les candidats devront désormais récolter 500 parrainages d’élus d’En Marche,politique
True,Anne Hidalgo prend la résolution de ne pas descendre en dessous de 1% dans les sondages,politique
True,Fact-check : Emmanuel Macron a-t-il vraiment fait une quenelle dans ses vœux pour la nouvelle année ?,politique
True,Eric Ciotti fait un cauchemar dans lequel il voit un drapeau algérien sous l’Arc de triomphe,politique
True,Emmanuel Macron annonce que le pass vaccinal devient obligatoire pour accéder aux centres de vaccination,politique
True,Arnaud Montebourg appelle tous les candidats de droite pour leur demander de se retirer,politique
True,"Valérie Pécresse : « être français, c’est mettre le lait avant les céréales dans son bol »",politique
True,Manuel Valls annonce son ralliement au futur président de la République,politique
True,Arnaud Montebourg affirme avoir en sa possession l’Anneau unique pour unir tous les candidats de la gauche,politique
True,"Xavier Bertrand : « Après mûre réflexion, j’ai décidé de renoncer à la primaire »",politique
True,Emmanuel Macron : « Je suis le seul candidat crédible capable de s’y retrouver dans le bordel que j’ai laissé »,politique
True,"L’allocution de Jean Castex, peur numéro 1 des moins de 75 ans",politique
True,Anne Hidalgo passe accidentellement sa liste de soutiens politiques à la machine à laver,politique
True,Jean-Michel Blanquer accuse le wokisme de posséder des armes de destructions massives,politique
True,Présidentielle : Anne Hidalgo creuse l’écart avec Jean Lassalle dans un nouveau sondage,politique
True,Inquiétude après que le gouvernement a proposé une idée qui ne soit pas un énième numéro vert,politique
True,La campagne électorale d’Anne Hidalgo relancée après un commentaire positif posté sur Facebook,politique
True,"Jean-Michel Blanquer « Le wokisme est responsable de la hausse des prix de l’énergie, des pénuries et des fermetures de lits dans les hôpitaux »",politique
True,"En tête dans les sondages, l’abstention refuse toujours de déclarer sa candidature",politique
True,Polémique après que Cthulhu a visé des journalistes avec un de ses tentacules,politique
True,"Pour tenter de contrer Zemmour médiatiquement, Yannick Jadot abat deux éléphants",politique
True,"En baisse dans les sondages, Anne Hidalgo propose une alliance à Jacques Cheminade",politique
True,Primaire de la gauche – Anne Hidalgo promet de doubler le nombre de promesses électorales,politique
True,"Selon un sondage, 17 Français ne seraient pas encore candidats à l’élection présidentielle",politique
True,Médiapart révèle qu’Éric Zemmour aurait mangé un tajine au poulet en 2013,politique
True,Présidentielle – Un premier sondage place Cthulhu au second tour,politique
True,"Pour faire parler de lui, Nicolas Dupont-Aignan aurait soudoyé trois passants pour lui jeter des oeufs au visage",politique
True,"S’il est élu, Eric Zemmour propose de faire entrer le maréchal Pétain au Panthéon à la place de Jean Moulin",politique
True,Le second tour de la primaire écologiste annulé après l’impression de bulletins de vote non recyclables,politique
True,Crise des sous-marins australiens – Jean-Yves Le Drian décide de jeter tous ses albums de Kylie Minogue,politique
True,Mécontent de ses nouvelles croquettes Jordan Bardella s’en prend au canapé de Marine Le Pen,politique
True,Censure médiatique – Pourquoi Gulli refuse toujours de donner la parole à Eric Zemmour,politique
True,Test : votre année scolaire sera-t-elle pleine de succès ou êtes-vous François Bayrou ?,politique
True,Yannick Jadot veut remplacer la province par un immense panneau solaire,politique
True,Jean-Michel Blanquer affirme que l’allocation rentrée scolaire sert à alimenter des comptes offshores,politique
True,Afghanistan : la France s’engage solennellement à accueillir 1 réfugié,politique
True,Présidentielle: Xavier Bertrand plus confiant que jamais après avoir été reconnu au Novotel d’Avignon,politique
True,Les députés valident l’obligation du pass sanitaire pour accéder aux manifestations contre le pass sanitaire,politique
True,Le fort de Brégançon loué deux semaines au youtubeur Emmanuel Macron,politique
True,Ce qu’il fallait retenir de l’allocution d’Emmanuel Macron,politique
True,En soutien à Emmanuel Macron chaque Français invité à se gifler lui-même ce soir à 20:00,politique
True,Emmanuel Macron : « Les classes fermeront au premier cas avéré de gauchisme »,politique
True,Jean Castex confirme la réouverture des restaurants à la mi-mai de 20h à 22h les soirs de pleine lune,politique
True,Le gouvernement pourrait prendre de nouvelles mesures en cas de … oh et puis merde on s’en tape y’en a marre,politique
True,Le gouvernement reconnaît avoir organisé plusieurs Conseils des ministres clandestins pendant la pandémie,politique
True,"Pour désengorger les services de réanimation, le gouvernement passe commande de 2000 tapis de sol",politique
True,L’homme qui affirmait avoir compris les nouvelles mesures sanitaires du gouvernement va entrer au gouvernement,politique
True,Jean Castex « L’apparition de variants régionaux du coronavirus est une chance pour les territoires »,politique
True,"Sur Twitter, Christine Boutin s’insurge contre le signe de la croix utilisé dans une addition",politique
True,"Gabriel Attal : « S’il fait beau depuis plusieurs jours, c’est grâce à l’action du gouvernement »",politique
True,Le gouvernement publiera l’historique internet de ceux qui refusent de se faire vacciner,politique
True,"En manque de doses de vaccin, le gouvernement va injecter des applaudissements aux soignants",politique
True,Récidive – Prison ferme pour un délinquant au casier judiciaire lourdement chargé,politique
True,Reconfinement – Le gouvernement se donne encore 8 jours pour savoir s’il aurait fallu faire quelque chose il y a 3 semaines,politique
True,Ce qu’il fallait retenir de l’allocution de Jean Castex,politique
True,Gérald Darmanin « Défendre la viande à la cantine c’est défendre la laïcité »,politique
True,Covid19 – Emmanuel Macron signe un décret ordonnant que François Hollande soit vacciné tout en dernier,politique
True,Les députés En Marche proposent que le président de la république soit élu au suffrage universel direct par un cabinet de conseil,politique
True,"Pour remonter le moral des Français, Jean Castex fera désormais ses annonces déguisé en tournesol",politique
True,Olivier Véran : « Les filles qui se feront vacciner en discothèque auront droit à une conso gratuite »,politique
True,Ce qu’il fallait retenir de l’allocution hebdomadaire de Jean Castex,politique
True,Emmanuel Macron : « Je ne changerai plus d’avis sur le confinement jusqu’à ce soir 19 heures »,politique
True,"Désobéissance civile : Vachement impressionné par le courage des Français, le virus annonce qu’il cesse toute contamination en France",politique
True,Le gouvernement refuse de parler d’un 3e confinement mais plutôt d’une « unité ternaire de restriction de mobilité à durée limitée »,politique
True,Génération identitaire – Le gouvernement furieux qu’un groupuscule lui ait volé toutes ses idées sur les migrants,politique
True,Le gouvernement qui avait essayé d’être convaincant sur le nombre de masques disponibles essaie d’être convaincant sur le nombre de doses de vaccins disponibles,politique
True,Couvre-feu à 18h : Ce qu’il fallait retenir des annonces de Jean Castex,politique
True,Jean-Luc Mélenchon accusé d’avoir fait la promotion d’un shampoing anti-pelliculaire Lidl,politique
True,Stratégie vaccinale : le gouvernement assume le fait que les 35 Français tirés au sort sont tous des proches d’Emmanuel Macron,politique
True,"Dans un excès de délire de fièvre, Emmanuel Macron prend accidentellement une mesure de gauche",politique
True,Le SMIC diminué de 5% pour financer la construction d’un hôpital à l’Élysée,politique
True,Emmanuel Macron annonce un référendum pour savoir s’il faut faire un truc pour le climat,politique
True,Des poissons panés en forme de Valérie Pécresse distribués dans les cantines d’Île-de-France,politique
True,"Sécurité Globale – Pour une meilleure surveillance par drone, le gouvernement veut bannir les volets et les rideaux",politique
True,Ce qu’il fallait retenir de Valéry Giscard d’Estaing,politique
True,Ce qu’il fallait retenir de l’allocution d’Emmanuel Macron,politique
True,"Pour changer de pièce à leur domicile, les Français devront également remplir une attestation",politique
True,Gérald Darmanin propose d’aider les journalistes en corrigeant tous les articles de presse avant publication,politique
True,Gérald Darmanin souhaite que Google floute les mots « violences policières » sur internet,politique
True,97% des Français favorables au vaccin s’il est d’abord testé sur des députés LREM,politique
True,Confinement – Jean Castex annonce une dérogation pour ceux qui ont un truc à faire dehors,politique
True,Présidentielle US : Les votes par télégramme seront décomptés d’ici décembre 2022,politique
True,Jean Castex dévoilera ce soir le nouveau protocole d’applaudissements aux soignants,politique
True,Reconfinement – Ce qu’il fallait retenir de l’allocution d’Emmanuel Macron,politique
True,Les 3 meilleurs sites de streaming pour suivre gratuitement l’allocution d’Emmanuel Macron,politique
True,Le ministre de la Santé sera cet après-midi chez Conforama pour acheter des lits de réa,politique
True,"Pour se protéger efficacement du Covid, Olivier Véran invite les Français à s’amputer les deux mains",politique
True,"Emmanuel Macron s’est trompé, il y aura en fait une baisse de 150 euros des APL",politique
True,Réunions privées : Les Français s’engageant à voter Macron en 2022 pourront inviter une 7e personne,politique
True,Ce qu’il fallait retenir des nouvelles mesures sanitaires proposées par Emmanuel Macron,politique
True,"Par souci d’efficacité, l’intégralité du gouvernement va être remplacé par un numéro vert",politique
