is_gorafi,title,category
True,Il devient champion du monde de mémoire en citant de tête toutes les affaires de Nicolas Sarkozy,culture
True,Édito : Pourquoi Le Gorafi quitte le réseau social Pinterest,culture
True,Guillaume Canet prépare une trilogie de biopic sur Guillaume Canet,culture
True,"Rencontre avec Régis, dernier CRS à ne pas être passé sur W9",culture
True,"20 ans plus tard, il comprend enfin une scène de Mulholland Drive",culture
True,Comment nudger votre quotidien et reset votre mindset pour ban les anglicismes ?,culture
True,"Pour remonter le moral des Français, L214 sort son bêtisier 2024",culture
True,"Qu’est-ce que le “manging en famille”, cette tendance qui revient souvent à Noël ?",culture
True,"Selon une étude, la plus belle preuve d’amour serait de partager ses codes Canal+",culture
True,Quel vin choisir pour accompagner une discussion sur le wokisme à Noël?,culture
True,Secret Santa : 6 idées cadeaux pour « l’autre con »,culture
True,Il écrit un roman de 500 pages pendant son attente aux urgences,culture
True,"Après le succès de “L’Amour ouf”, Gilles Lellouche annonce le tournage de la suite “La routine reloue”",culture
True,Inflation – Cette année les calendriers de l’avent n’auront qu’une seule case,culture
True,Le générique des douze coups de midi de nouveau élu personnalité préférée des chômeurs et des retraités,culture
True,"NRJ – À partir du 20 novembre, Manu dans le 6/10 va doubler vos impôts",culture
True,DAZN propose de rémunérer les téléspectateurs pour accéder à la chaîne,culture
True,Pour ou contre Jean-Luc Reichmann ?,culture
True,Test : Avec qui confondez-vous Quincy Jones ?,culture
True,Pour ou contre l’accrobranche ?,culture
True,"Pour Halloween, des Français veulent se faire peur au cinéma en allant voir le film 4 Zéros",culture
True,Ses parfaites connaissances de l’œuvre de Tolkien ne l’aident finalement pas à conclure,culture
True,Une battue organisée dans le Tarn-Et-Garonne pour retrouver la personne qui a “bien aimé” Joker 2,culture
True,Recettes d’automne : 8 façons de ne pas cuisiner le topinambour,culture
True,Fort Boyard : Les tigres finalement remplacés par Mathilde Panot,culture
True,« 100 conseils pour dire à une femme de se calmer » : le nouveau livre de Gérald Darmanin fait polémique,culture
True,Le film Le Comte de Monte-Cristo bientôt adapté en livre,culture
True,« T’Choupi va sur le pot » pressenti pour le Goncourt 2024,culture
True,"Accusé “d’agir en mafieux”, Cyril Hanouna met une tête de cheval dans le slip du directeur de l’ARCOM",culture
True,"Pour son anniversaire, il reçoit un livre qu’il n’a pas envie de lire d’un ami qui ne l’a pas lu",culture
True,3 choses que Center Parcs ne veut pas que vous sachiez,culture
True,Reformation d’Oasis – Gérald Darmanin annonce une « tolérance zéro » face à la recrudescence des reprises de “Wonderwall”,culture
True,Disparition à 88 ans de l’acteur qui interprétait César dans Astérix aux Jeux olympiques,culture
True,La mort de Patrice Laffont éteint tout espoir de comprendre les règles du jeu Pyramide,culture
True,"En hommage à C8, Vincent Bolloré organise une messe en latin",culture
True,Cyril Hanouna enregistrera TPMP depuis un bateau situé dans les eaux internationales,culture
True,Un fan d’NRJ 12 déçu de n’avoir pu voir que 8 fois les 12 saisons de The Big Bang Theory en VF,culture
True,Vincent Bolloré rachète l’Arcom,culture
True,Elisabeth Lévy s’insurge contre la présence de corps étrangers dans son vin rouge,culture
True,Législatives – CNews change son habillage avec un nouveau logo en berne,culture
True,Il est persuadé qu’il va recevoir un message de Margot Robbie après avoir commenté sa photo « canon la miss »,culture
True,"Pour équilibrer les temps de parole, l’ARCOM condamne CNews à diffuser des films de Ken Loach pendant deux ans",culture
True,Elle garde son tapis de yoga de 2015 en pensant encore qu’elle va s’y mettre,culture
True,Tous les gens que vous détestez sont encore au Festival de Cannes cette année,culture
True,"À peine arrivé au Paradis, Bernard Pivot corrige 8 fautes d’orthographe sur les Tables de la Loi",culture
True,Bernar Pivo e dcd,culture
True,Mask Singer – TF1 présente ses excuses après la découverte d’Alain Soral sous le costume du Cupcake,culture
True,France Inter – Guillaume Meurice remplacé dès dimanche par une sorte de nazi sans prépuce,culture
True,Il a hâte de lire les critiques du film qu’il vient de voir pour savoir s’il l’a aimé,culture
True,"Pour ne pas stresser pendant son premier jour, un acteur pornographique imagine tous ses collègues habillés",culture
True,Les prises de parole de Bernard-Henri Lévy considérées comme des « polluants éternels »,culture
True,10 décors cultes de la saga Marvel,culture
True,Mort de Frédéric Mitterrand – La Thaïlande décrète trois jours de deuil national,culture
True,"Qui est Patrice Mitonneau, le comédien derrière “Messi”, le chien d’Anatomie d’une chute ?",culture
True,Il fait un bilan sanguin et découvre qu’il est fan de Trois Cafés Gourmands,culture
True,"Netflix lance une offre à 0,08€ par mois qui donne seulement accès aux films de Philippe Lacheau",culture
True,La chouette de Duolingo condamnée à 2 ans de prison ferme pour harcèlement,culture
True,César 2024 : Les discours de Justine Triet seront encadrés par trois CRS et limités à 11 secondes,culture
True,"Nikon Festival – Malgré ses 130 stories en 48 heures, personne ne regardera son court-métrage",culture
True,César 2024 : Rachida Dati nommée dans la catégorie “meilleure actrice” pour son rôle de ministre de la Culture,culture
True,Vincent Bolloré rachète Mediapart,culture
True,"Selon une étude, prendre des photos floues en noir et blanc ne ferait pas de vous un photographe talentueux",culture
True,L’homme qui répétait les mots “goat” “dinguerie” et “masterclass” vient d’obtenir un stage chez Konbini,culture
True,Charles Ingalls continue d’apparaître dans les rêves érotiques de votre grand-mère,culture
True,Le livre sur sa table de chevet est le même depuis six mois,culture
True,Star Academy – un élève émeut les téléspectateurs avec sa version acoustique de « La Zoubida »,culture
True,"Le 16 Janvier 2024, Michel Drucker tombe dans le domaine public",culture
True,TEST : Méritez-vous le nouveau livre du Gorafi ?,culture
True,Clique s’accorde une immense fête dans ses locaux pour célébrer le cap des 12 téléspectateurs,culture
True,"Après Spotify, Pornhub lance également sa rétrospective à partager avec vos amis sur les réseaux",culture
True,"8 ans plus tard, un enfant disparu au spectacle d’Eric Antoine réapparaît derrière une oreille",culture
True,5 incohérences historiques dans le Napoléon de Ridley Scott,culture
True,Netflix renouvelle Narcos pour une saison 4 autour « du cartel du Sénat »,culture
True,Uno – Le jeu annonce l’arrivée d’une carte 49.3 pour contrer un +4,culture
True,TEST – Êtes-vous une écluse ?,culture
True,Insolite : un enfant monte le toboggan par l’escalier,culture
True,"La 1ère édition de “LOL : Qui paie ses impôts en France, sort ! ” débarque sur Amazon Prime",culture
True,Beauté – Quel monoï choisir pour la fin du monde ?,culture
True,Le prix Nobel de littérature attribué à un graffiti sur un mur de toilettes d’un bar de Rennes,culture
True,"En réponse à la visite du pape à Marseille, la prochaine saison des Marseillais aura lieu au Vatican",culture
True,La ministre de la Culture promet des cellules de garde à vue “tout confort” pour les journalistes,culture
True,Il n’est toujours pas bilingue après 10 ans à regarder des séries en VOSTFR,culture
True,UGC propose des places à 100 euros pour avoir un siège sans punaise de lit,culture
True,"Après avoir loupé une marche, Gad Elmaleh voit toute la vie de Jerry Seinfeld défiler devant ses yeux",culture
True,Test : de quelle couleur est le cheval blanc d’Henri IV ?,culture
True,Elle ajoute une expérience de commerciale sur son CV après avoir négocié un t-shirt sur vinted,culture
True,"À 40 ans, il abandonne ses rêves de faire de la musique et se lance dans le reggaeton",culture
True,Le CNC force Justine Triet à réaliser «Qu’est-ce qu’on a fait au bon Dieu ? 4»,culture
True,"Après seulement 3 semaines de salle de sport, il ressent déjà les bénéfices réalisés par la salle de sport",culture
True,Un producteur inconscient envisage un divertissement sans Jonathan Cohen,culture
True,"« Lol » – Après la polémique, Tex annonce qu’il refuse de participer à son tour à l’émission",culture
True,TPMP : Cyril Hanouna a-t-il eu raison d’inviter Nordahl Lelandais pour parler des retraites ?,culture
True,96% des coachs en séduction avouent que le meilleur conseil reste « Sur un malentendu ça peut marcher »,culture
True,Il devient expert en féminisme après avoir lu la préface de “Sorcières” de Mona Chollet,culture
True,Oenologie : il a épuisé tous les adjectifs qu’il connaissait au bout de deux gorgées de vin,culture
True,Drame – Cyril Hanouna,culture
True,Stéphane Bern hospitalisé d’urgence après l’annonce du report de la visite de Charles III,culture
True,Laissé sans surveillance pendant dix minutes le logiciel Chat GPT écrit le scénario d’Alibi . Com 3,culture
True,"Après Brad Pitt aux César, Frédéric Diefenthal a honoré les Oscars de sa présence",culture
True,Attentat lors d’une projection du film de BHL : zéro mort,culture
True,"Votre meilleur ami remporte le César du meilleur acteur pour sa prestation dans « Désolé, j’avais pas vu ton message »",culture
True,"Après BFM Business, lancement de BFM Pierre Palmade",culture
True,César 2023 : l’Académie assure que des femmes seront présentes pour servir les petits fours,culture
True,Il allume sa télévision et ne tombe pas sur Guillaume Canet en promo d’Astérix,culture
True,Le nouveau film primé à Sundance parlera de deux américains moyens un peu perdus sur fond de musique folk,culture
True,Inflation – La série « Dix pour cent » rebaptisée « Vingt-cinq pour cent »,culture
True,7 choses à retenir du livre du prince Harry « Le Suppléant »,culture
True,Il achète le livre du Gorafi et couche avec 24 femmes le jour-même,culture
True,L’ARCOM pense à l’éventualité de la possibilité de peut-être sanctionner C8 après la 10 000e plainte,culture
True,Il se fait tatouer en espérant avoir enfin une personnalité,culture
True,Un chorizo raconte l’enfer des corridas,culture
True,Cyril Hanouna remercie ses chroniqueurs et promet de « leur rendre un jour leur passeport »,culture
True,Test – Est-ce que ce mur est porteur ?,culture
True,"Happé par le suspens de son jeu d’escape quest, il rate son mariage et redevient célibataire",culture
True,L’homme qui critiquait les films au cinéma vient de terminer la saison 2 d’Emily In Paris,culture
True,Il achète un livre sur le plaisir féminin au lieu de regarder du porno comme tout le monde,culture
True,Drop shipping – Magali Berdah vend son âme au diable trois fois le prix d’achat,culture
True,Netflix : 6 séries à voir absolument que vous aurez oubliées dans 5 jours,culture
True,"À la dernière minute, Editis suspend la publication du calendrier érotique de Vincent Bolloré",culture
True,BFMTV s’excuse après avoir parlé d’autre chose que de la mort de la Reine,culture
True,Test : Est-ce que tu m’entends hey ho?,culture
True,Les 5 meilleures leçons de vie du Dalaï-Lama,culture
True,Cannes – un festivalier se repose d’une semaine de fête devant un bon vieux film,culture
True,"Déchéance : après son divorce et la perte de son emploi, il devient fan d’un animateur TV",culture
True,Netflix augmente le prix de son abonnement pour ceux qui regardent leur téléphone pendant les films,culture
True,Liberté d’expression: Un rapport démontre que ******* et ***** pour **********,culture
True,Concert d’Orelsan – L’homme qui chante à tue-tête « L’odeur de l’essence » va voter Macron dans 3 semaines,culture
True,L’implant cérébral d’Elon Musk permettra de comprendre les films de Christopher Nolan,culture
True,Le documentaire sur la vie du groupe Tragédie encore refusé par Netflix,culture
True,Jean-Pierre Pernaut sera inhumé dans un cercueil fabriqué à la main par le dernier petit artisan du Poitou,culture
True,Emmanuel Macron menace de couper aux Russes l’accès à Salto,culture
True,Prison ferme pour l’homme qui avait oublié sa carte de fidélité du magasin,culture
True,Décathlon lance le premier casque de vélo qui ne fait pas une tête de gland,culture
True,Vincent Bolloré rachète le collectif StopBolloré,culture
True,Magie : Eric Antoine recalé de Poudlard pour la 15ème année de suite,culture
True,"Face à Baba : Dorénavant, les candidats débattront uniquement en onomatopées",culture
True,Il brise la routine de son tour du monde en s’accordant un CDD de 6 mois à la Défense,culture
True,"Pour gagner en popularité, une star hésite encore entre rencontrer un enfant leucémique ou tétraplégique",culture
True,"Après 10 ans de relation, ils sautent le pas et prennent enfin une carte UGC Illimité Duo",culture
True,France – Elle devient la première personne à lire le livre qu’on lui a offert pour Noël,culture
True,Test : quel cadeau de Noël raté êtes-vous ?,culture
True,Santé : Michel Cymes recommande aux Français de lui faire un massage des pieds,culture
True,La Fnac va proposer un rayon “banalités” pour les cadeaux à destination des gens dont vous n’avez rien à foutre,culture
True,Cet article est réservé aux abonnés,culture
True,Il obtient enfin le stage d’observation de ses rêves au Gorafi,culture
True,Michael Bay viré de son documentaire animalier après avoir fait exploser un hippopotame,culture
True,Instagram – La story de lui en train de boxer ne fait peur à personne,culture
True,La personne qui n’avait pas le temps pour boire un verre vient de binge-watcher 77 heures de séries Netflix,culture
True,Deux fact-checkeurs meurent d’épuisement après avoir vérifié tous les propos de Michel Onfray,culture
True,5 épisodes de Louis la Brocante pour patienter avant la sortie du second volet de Dune,culture
True,"“Les 10 ans du Gorafi”, toujours le livre le plus lu aux toilettes",culture
True,"Squid Game : On a toujours pas regardé, et alors ? Qu’est-ce que vous allez faire, hein ?",culture
True,Le Covid 19 jaloux de la couverture médiatique accordée à Éric Zemmour,culture
True,L’agent secret Bob Saint-Clar porté disparu au cours d’une périlleuse dernière mission,culture
True,Malgré la polémique C8 diffusera bien un film affirmant que la Terre est plate,culture
True,Richard Anconina accusé de ne jouer que dans des films avec Richard Anconina,culture
True,Clara Luciani confirme qu’elle continuera à faire de la promo tant que vous n’avez pas acheté son album,culture
True,France-Portugal : 70 kilos de blagues sur les maçons et les poils saisies dans les locaux des Grosses-Têtes,culture
True,Europe 1- Nouvelle inquiétude après que Vincent Bolloré a proposé de faire un « gros méchoui » avec les restes des journalistes,culture
True,Bac : 3 erreurs à ne pas commettre pour réussir l’épreuve de philosophie,culture
True,TF1 rachète les droits de votre vie pour l’adapter en moins bien,culture
True,Mein Kampf – Que vaut le reboot 2021 ?,culture
True,82% des Français favorables à ce que les frères Bogdanoff conservent leur masque après la pandémie,culture
True,Eric Zemmour obligé de prendre un second travail pour payer l’amende de CNews,culture
True,Samuel Étienne contraint de se justifier après avoir invité Cthulhu sur sa chaîne Twitch,culture
True,"Sondage : après les Daft Punk, 81% des Français craignent une séparation des Chevaliers du Fiel",culture
True,Salto va autoriser son abonné à partager ses codes avec l’ensemble des Français,culture
True,Test : Est-ce que tu viens pour les vacances ?,culture
True,Un marginal tape encore « www. » dans sa barre de recherche pour surfer sur internet,culture
True,TEST : Êtes-vous complotiste ou un mouton obéissant aux merdias ?,culture
True,"Jean-Pierre Bacri se dit « content de ne pas être mort en 2020, comme tous ces cons-là ! »",culture
True,"Lors d’une randonnée en solitaire, Pascal Praud réussit à ne se couper que 10 fois la parole",culture
True,"Par crainte d’être mis à pied ou renvoyés, tous les Français suppriment les propos négatifs qu’ils ont eu un jour contre CNews",culture
True,Vincent Bolloré se licencie lui-même après s’être souvenu avoir rigolé à un sketch de Sébastien Thoen,culture
True,Mort de l’interprète de Dark Vador : David Prowse sera incinéré par un rayon de laser pulvérisant la Terre,culture
True,Pascal Praud licencié du groupe Canal après une émission parodiant le journalisme,culture
True,Michel Houellebecq profite du confinement pour lancer sa chaîne YouTube de tutos de dépression,culture
True,France – Les journalistes finalement autorisés à couvrir les manifestations à condition de respecter une distance de sécurité de 500 kilomètres,culture
True,Netflix obtient les droits pour adapter l’année 2020 en série,culture
True,"Selon le CNC, il faudrait douze comédies racistes supplémentaires pour sauver le cinéma français",culture
True,Nouvelle polémique après qu’un polémiste a réagi à la dernière polémique du polémiste très polémique,culture
True,Le prix Nobel de littérature décerné à Nicolas Sarkozy pour son livre « Le Temps des Tempêtes »,culture
True,Christophe Maé se blesse grièvement en rendant hommage à Van Halen à la guitare,culture
True,CNews affirme qu’elle ignorait que Eric Zemmour tenait des propos racistes depuis des années sur son antenne,culture
True,Biodiversité : la chasse bientôt autorisée dans les parcs et cimetières parisiens,culture
True,La Reine des neiges 3 ne sortira qu’en produits dérivés,culture
True,Bretagne – Il pêche un superbe masque FFP2 de 2 kilos 7,culture
True,"Fort Boyard – Face aux protestations, la production s’engage à ne plus utiliser d’Olivier Minne dans l’émission",culture
True,"“Tu vas voir, Paris en août c’est génial” par votre ami en vacances aux Seychelles",culture
True,Un rapport révèle que la France n’est pas préparée en cas de reformation du groupe Whatfor,culture
True,CNews va engager un ragondin comme chroniqueur de gauche,culture
True,Montpellier – Il met de l’huile,culture
True,"Disney annonce que, dans les prochains Star Wars, Chewbacca sera interprété par un vrai Wookiee",culture
True,Le cinéma français songe à sortir un film sans Camille Cottin en 2021,culture
True,"Après « Autant en Emporte le Vent », tous les films de Christian Clavier vont être retirés pour être « recontextualisés »",culture
True,La culture toujours dans la crainte d’une 2e vague de Franck Riester,culture
True,"Pour protéger la biodiversité, le président de la Fédération nationale des chasseurs propose d’abattre tous les promeneurs à plus de 300 mètres de chez eux",culture
True,« Ah oui tiens je vais regarder ! » par cet homme à qui on vient de conseiller une série qu’il ne regardera jamais,culture
True,Richard Anconina va lancer l’AnconinApp une appli pour suivre toute l’actu de Richard Anconina,culture
True,Il a hâte que le confinement se termine pour relancer le débat sur la soirée des César,culture
True,Test : Sur quelle musique de la Compagnie Créole vos parents vous ont-ils conçu ?,culture
True,Elle n’a toujours pas regardé le spectacle de rue qu’elle avait filmé mécaniquement l’été dernier,culture
True,Polémique après que Marie S’Infiltre se filme en train de tousser sur les résidents d’un Ehpad,culture
True,« J’ai binge-watché une série tout le week-end » par ce père de famille qui a regardé 12 saisons de Franklin la tortue,culture
True,Prolongation du confinement : Richard Anconina s’exprimera à 20h30,culture
True,80% des Français avouent ne pas savoir comment recharger leurs livres,culture
True,Le Coronavirus sauve plusieurs milliers de personnes d’un concert de Christophe Maé,culture
True,Le réalisateur Wes Anderson placé en garde à vue suite à des plans de son prochain film jugés pas assez symétriques,culture
True,Coronavirus – Le monde bascule dans le chaos après l’annonce d’un possible report de la Playstation 5,culture
True,Le gouvernement souhaite relancer le débat autour de Richard Anconina,culture
True,À 60 ans Nicola Sirkis annonce officiellement qu’il va mettre fin à sa crise d’adolescence,culture
True,Insolite : un journaliste réalise la première interview avec concession,culture
True,La France a un incroyable talent : le candidat qui prétendait avoir fait le Débarquement de Normandie avait menti,culture
True,Vincent Bolloré licencie la totalité de CNews pour ne garder que Eric Zemmour,culture
True,Le dragon du “Hobbit” déçu d’être appelé que pour des rôles de dragon au cinéma,culture
True,5 photos de stars avant leur naissance,culture
True,Les présidents de chaînes de télévisions se retrouvent dans les sous-sol du CSA pour la cérémonie hebdomadaire de sortilèges pour contrer Netflix,culture
True,"Dans l’espoir de booster leurs futures carrières, des dizaines de jeunes écrivains lancent à leur tour leurs propres revues antisémites",culture
True,Les médias contraints de trouver d’autres sujets à traiter après que Yann Moix a annoncé se retirer des médias,culture
True,"« Je ne suis pas antisémite, cette polémique ça doit encore être un coup des Juifs » par Yann Moix",culture
True,"Refusant son traitement anti-moustiques, Aymeric Caron meurt de la dengue, du paludisme et du chikungunya",culture
True,5 façons d’utiliser un livre de Marc Levy à la plage,culture
True,Laurence Sailliet chez Hanouna – Les chroniqueurs télé inquiets que l’arrivée des politiques dans les émissions ne décrédibilise leur métier,culture
True,"Trop de partages de comptes : En France, seulement douze personnes seraient vraiment abonnées à Netflix",culture
True,BFM TV contraint de licencier 120 journalistes en raison de la fin de la canicule,culture
True,Tomer Sisley accusé d’avoir plagié les accusations de Philippe Lellouche envers Kheiron,culture
True,Les scénaristes de Game of Thrones invitent tous ceux qui n’ont pas aimé la dernière saison à leur chaleureux mariage,culture
True,Le CSA autorise les coupures pub entre deux de vos rêves,culture
True,Gorarécap Game of Thrones Saison 8 épisode 6,culture
True,Le gagnant des 21 millions d’euros du Loto annonce qu’il va financer une nouvelle saison de Game of Thrones,culture
True,Gorarécap Game of Thrones saison 8 épisode 5,culture
True,Gorarécap Game of Thrones Saison 8 épisode 4,culture
True,La personne qui criait « à poil !!! » dans les concerts prend sa retraite à 52 ans,culture
True,Gorarécap Game of Thrones saison 8 épisode 3,culture
True,"Pour éviter un nouveau drame national, le gouvernement va installer un détecteur de fumée sur Michel Drucker",culture
True,Yann Moix :  » Moi de toute façon je suis incapable d’aimer une cathédrale de plus de 50 ans »,culture
True,Gorarécap Game of Thrones Saison 8 épisode 1,culture
True,"Arrivé en haut de l’Everest, il atteint enfin le post Instagram de ses rêves",culture
True,Test : Avez-vous la chanson « The Final Countdown » dans la tête ?,culture
True,Balance ton Post : Cyril Hanouna défend son interview d’Adolf Hitler,culture
True,Sa passion du moment à deux doigts de se transformer en un énième podcast,culture
True,Le spectacle de Bernard-Henri Lévy affiche déjà cinq places,culture
True,Le bruit de la boîte de nuit l’empêche d’avoir une discussion sur l’impératif catégorique de Kant,culture
True,Joueurs de cornemuse – Bientôt des médiateurs dans chaque département,culture
True,Cyril Hanouna organise un combat de coq et un lancer de nain pour financer sa banque du cœur,culture
True,Polémique après qu’une vidéo où Bilal Hassani mange une pizza en laissant la croûte de côté a refait surface,culture
True,César : Marlène Schiappa s’insurge contre l’absence de femmes dans la catégorie « meilleur acteur »,culture
True,Il passe en navigation privée pour écouter le dernier album d’Indochine,culture
True,5 preuves que vous devez démissionner pour devenir taxidermiste,culture
True,Cyril Hanouna pressenti pour animer le prochain sommet du G7,culture
True,Marie Kondo recommande de ne garder que trois membres de votre famille,culture
True,BFM TV va sortir un coffret des trois premières saisons d’Alexandre Benalla,culture
True,"Pour son prochain tirage, le nouveau Houellebecq sera vendu avec du Lexomil",culture
True,La marionnette de Jeff Panacloc échappe à son contrôle et sort une réplique presque drôle,culture
True,BFMTV s’excuse pour avoir laissé passer des journalistes sur son antenne,culture
True,Violente bagarre entre Dany Boon et Kad Merad pour savoir qui fera la première comédie sur les Gilets Jaunes,culture
True,Gilets jaunes – France 2 prépare un «Rendez-vous en Terre inconnue» pour emmener Emmanuel Macron dans un Lidl de province,culture
True,Mort du doyen des fans de M. Pokora à l’âge de neuf ans,culture
True,"Pour relancer sa carrière, sa maison de disque lui conseille de mourir",culture
True,Les fans en colère après que Marvel a décidé de faire mourir Stan Lee,culture
